Tema;Sudėtingumas;Klausimo autorius;Klausimo tekstas;Atsakymo variantai;Teisingas atsakymas;Balai;
Įvairūs;2;Robertas Petrauskas;Kaip NATO fonetinėje abėcėlėje šifruojama raidė R?;Romeo,Rembo,Raily,Rodeo;Romeo;2;
Anotomija ir medicina;2;Rimantas Valiukonis;Koks augalas vienos rūšies žinduoliui sukelia euforiją, o kitos rūšies žinduolį nuramina?;Kanapė,Durniaropė,Valerijonas,Aguona;Valerijonas;2;
Įvairūs;2;Mantas Stonkus;Koks augalas lotyniškai vadinasi Urtica?;Pienė,Dilgėlė,Usnis,Melisa;Dilgėlė;3;
Geografija;2;Viktoras Drąsutavičius;Prie kokios jūros įsikūręs Vladivostokas?;Rytų Sibiro,Japonijos,Čiukčių,Beringo;Japonijos;2;
Įvairūs;2;Ramunė Vinauskaitė;Kokį gėrimą italai vadina spumante?;Anyžinę dektinę,Baltąjį vyną,Putojantį vyną,Raudonąjį vyną;Putojantį vyną;3;
